{
  "raw_event_id": "a1b2c3d4-e5f6-4a1b-8c2d-3e4f5a6b7c8d",
  "schema_version": "1.0",
  "event_type": "decoy_page_visited",
  "event_category": "request",
  "decoy_id": "WEB-001",
  "collector_id": "collector-agent-01",
  "observed_at": "2026-10-31T10:15:30.123456+00:00",
  "received_at": "2026-10-31T10:15:30.150000+00:00",
  "timestamp_precision": "microsecond",
  "source_timezone": "UTC",
  "session_id": "decoy_sess_3430c5e63810486c99cff33faad6a50d",
  "interaction_id": "req_a1b2c3d4e5f60101",
  "associated_request_id": null,
  "source": {
    "ip_address": "198.51.100.45",
    "port": 54321,
    "protocol": "https",
    "user_agent_summary": "Mozilla/5.0 (Windows NT 10.0; Win64; x64) Chrome/120.0.0.0"
  },
  "request": {
    "method": "GET",
    "path": "/login",
    "content_type": null,
    "headers_summary": {
      "accept": "text/html,application/xhtml+xml",
      "host": "portal.apexcore.local"
    }
  },
  "interaction": {
    "username_fingerprint": null,
    "username_length": null,
    "password_present": false,
    "password_length_category": "none",
    "status_code": 200,
    "simulated_outcome": "portal_rendered",
    "notes": "Initial corporate authentication portal view",
    "payload_markers": []
  },
  "provenance": {
    "source_type": "controlled_test",
    "source_id": "lab-vm-node-01",
    "environment": "isolated_lab",
    "collection_method": "local_file_tail",
    "simulation_run_id": "sim_p11_test_run_01"
  },
  "processing": {
    "ingestion_status": "ingested",
    "validation_status": "valid",
    "processing_timestamp": "2026-10-31T10:15:30.160000+00:00",
    "deduplication_hash": "e3b0c44298fc1c149afbf4c8996fb92427ae41e4649b934ca495991b7852b855"
  }
}
