{
  "raw_event_id": "b2c3d4e5-f6a1-4b2c-9d3e-4f5a6b7c8d9e",
  "schema_version": "1.0",
  "event_type": "login_attempt",
  "event_category": "authentication",
  "decoy_id": "WEB-001",
  "collector_id": "collector-agent-01",
  "observed_at": "2026-10-31T10:15:35.654321+00:00",
  "received_at": "2026-10-31T10:15:35.670000+00:00",
  "timestamp_precision": "microsecond",
  "source_timezone": "UTC",
  "session_id": "decoy_sess_3430c5e63810486c99cff33faad6a50d",
  "interaction_id": "req_b2c3d4e5f6a10202",
  "associated_request_id": null,
  "source": {
    "ip_address": "198.51.100.45",
    "port": 54321,
    "protocol": "https",
    "user_agent_summary": "Mozilla/5.0 (Windows NT 10.0; Win64; x64) Chrome/120.0.0.0"
  },
  "request": {
    "method": "POST",
    "path": "/login",
    "content_type": "application/x-www-form-urlencoded",
    "headers_summary": {
      "accept": "text/html,application/xhtml+xml",
      "host": "portal.apexcore.local"
    }
  },
  "interaction": {
    "username_fingerprint": "7c4852c2863cb6ff7bb84f50684f00db1e075c35399587ccf618a8efaa6734ee",
    "username_length": 18,
    "password_present": true,
    "password_length_category": "medium (8-16)",
    "status_code": 401,
    "simulated_outcome": "simulated_auth_failure",
    "notes": "Standard corporate probe attempt",
    "payload_markers": []
  },
  "provenance": {
    "source_type": "controlled_test",
    "source_id": "lab-vm-node-01",
    "environment": "isolated_lab",
    "collection_method": "local_file_tail",
    "simulation_run_id": "sim_p11_test_run_01"
  },
  "processing": {
    "ingestion_status": "ingested",
    "validation_status": "valid",
    "processing_timestamp": "2026-10-31T10:15:35.680000+00:00",
    "deduplication_hash": "a1c2e3f4b5d6a7b8c9d0e1f2a3b4c5d6e7f8a9b0c1d2e3f4a5b6c7d8e9f0a1b2"
  }
}
